<?xml version="1.0" encoding="utf-8"?>
<!DOCTYPE dict SYSTEM "gml.dtd">
<dict xmlns="http://www.gelaba.org/gml/1.0" name="dict-regions-france">
  <fullname xml:lang="fr">Régions françaises</fullname>
  <entry>
    <key val="01"/>
    <key val="1"/>
    <value xml:lang="fr" val="Guadeloupe"/>
  </entry>
  <entry>
    <key val="02"/>
    <key val="2"/>
    <value xml:lang="fr" val="Martinique"/>
  </entry>
  <entry>
    <key val="03"/>
    <key val="3"/>
    <value xml:lang="fr" val="Guyane"/>
  </entry>
  <entry>
    <key val="04"/>
    <key val="4"/>
    <value xml:lang="fr" val="Réunion"/>
  </entry>
  <entry>
    <key val="11"/>
    <value xml:lang="fr" val="Île-de-France"/>
  </entry>
  <entry>
    <key val="21"/>
    <value xml:lang="fr" val="Champagne-Ardenne"/>
  </entry>
  <entry>
    <key val="22"/>
    <value xml:lang="fr" val="Picardie"/>
  </entry>
  <entry>
    <key val="23"/>
    <value xml:lang="fr" val="Haute-Normandie"/>
  </entry>
  <entry>
    <key val="24"/>
    <value xml:lang="fr" val="Centre"/>
  </entry>
  <entry>
    <key val="25"/>
    <value xml:lang="fr" val="Basse-Normandie"/>
  </entry>
  <entry>
    <key val="26"/>
    <value xml:lang="fr" val="Bourgogne"/>
  </entry>
  <entry>
    <key val="31"/>
    <value xml:lang="fr" val="Nord-Pas-de-Calais"/>
  </entry>
  <entry>
    <key val="41"/>
    <value xml:lang="fr" val="Lorraine"/>
  </entry>
  <entry>
    <key val="42"/>
    <value xml:lang="fr" val="Alsace"/>
  </entry>
  <entry>
    <key val="43"/>
    <value xml:lang="fr" val="Franche-Comté"/>
  </entry>
  <entry>
    <key val="52"/>
    <value xml:lang="fr" val="Pays de la Loire"/>
  </entry>
  <entry>
    <key val="53"/>
    <value xml:lang="fr" val="Bretagne"/>
  </entry>
  <entry>
    <key val="54"/>
    <value xml:lang="fr" val="Poitou-Charentes"/>
  </entry>
  <entry>
    <key val="72"/>
    <value xml:lang="fr" val="Aquitaine"/>
  </entry>
  <entry>
    <key val="73"/>
    <value xml:lang="fr" val="Midi-Pyrénées"/>
  </entry>
  <entry>
    <key val="74"/>
    <value xml:lang="fr" val="Limousin"/>
  </entry>
  <entry>
    <key val="82"/>
    <value xml:lang="fr" val="Rhône-Alpes"/>
  </entry>
  <entry>
    <key val="83"/>
    <value xml:lang="fr" val="Auvergne"/>
  </entry>
  <entry>
    <key val="91"/>
    <value xml:lang="fr" val="Languedoc-Roussillon"/>
  </entry>
  <entry>
    <key val="93"/>
    <value xml:lang="fr" val="Provence-Alpes-Côte d'Azur"/>
  </entry>
  <entry>
    <key val="94"/>
    <value xml:lang="fr" val="Corse"/>
  </entry>
</dict>
